{
  "$schema": "https://json-schema.org/draft/2020-12/schema",
  "$id": "https://oats.dev/schemas/capability-manifest.schema.json",
  "title": "OATS capability package manifest",
  "type": "object",
  "required": [
    "capability",
    "version",
    "description"
  ],
  "$defs": {
    "HelperInjection": {
      "oneOf": [
        {"type":"object","required":["version","mode"],"additionalProperties":false,"properties":{"version":{"const":1},"mode":{"enum":["inherit","omit"]}}},
        {"type":"object","required":["version","mode","path"],"additionalProperties":false,"properties":{"version":{"const":1},"mode":{"const":"file"},"path":{"type":"string","minLength":1,"pattern":"^(?![A-Za-z]:)(?!.*(?:^|/)\\.{1,2}(?:/|$))[^/\\\\\u0000]+(?:/[^/\\\\\u0000]+)*$"}}}
      ]
    },
    "HookInputs": {
      "type":"object","additionalProperties":false,
      "properties":{"sourceReceipt":{"type":"object","required":["version"],"additionalProperties":false,"properties":{"version":{"const":1}}}}
    },
    "OptionalHook": {
      "oneOf":[
        {"type":"string"},
        {"type":"object","required":["command"],"additionalProperties":false,"properties":{"command":{"type":"string"},"required":{"const":false,"description":"Only the existing spawn hook may be required."},"inputs":{"$ref":"#/$defs/HookInputs"}}}
      ]
    }
  },
  "properties": {
    "capability": {
      "type": "string",
      "pattern": "^(?:@?[a-z0-9][a-z0-9._-]*[./])[a-z0-9][a-z0-9._/-]*$"
    },
    "command": {
      "type": "string",
      "pattern": "^[a-z0-9][a-z0-9-]*$"
    },
    "version": {
      "type": "string",
      "minLength": 1
    },
    "compatibility": {
      "type": "object",
      "properties": {
        "oats": {
          "type": "string"
        }
      },
      "required": [
        "oats"
      ],
      "additionalProperties": false
    },
    "description": {
      "type": "string",
      "minLength": 1
    },
    "private": {
      "type": "boolean",
      "description": "Workspace discovery: true makes this member capability repo-owned — listed (private: true) but usable only by souls of its own repository (E_CAPABILITY_PRIVATE elsewhere)."
    },
    "team": {
      "type": "string",
      "pattern": "^[a-z0-9][a-z0-9._-]*$",
      "description": "Workspace discovery: the team label for this capability; else the repository's default from oats-membership.yaml."
    },
    "layer": {
      "enum": [
        "knowledge",
        "messaging",
        "tasks"
      ]
    },
    "skills": {
      "type": "array",
      "items": {
        "type": "string"
      },
      "uniqueItems": true
    },
    "inject": {
      "type": "string"
    },
    "helperInjection": {"$ref":"#/$defs/HelperInjection"},
    "environment": {
      "type": "array",
      "items": {
        "type": "string",
        "pattern": "^[A-Za-z_][A-Za-z0-9_]{0,127}$"
      },
      "uniqueItems": true,
      "description": "Exact launch-environment names this artifact asks the executable trust gate to approve; spawn hook output must be a subset."
    },
    "requires": {
      "type": "array",
      "items": {
        "oneOf": [
          {
            "title": "host command requirement",
            "description": "A command that must be present on PATH before the capability can work.",
            "type": "object",
            "required": [
              "command",
              "why"
            ],
            "properties": {
              "command": {
                "type": "string"
              },
              "why": {
                "type": "string"
              },
              "install": {
                "type": "string"
              }
            },
            "additionalProperties": false
          },
          {
            "title": "harness package requirement",
            "description": "A package that must be installed into a specific harness's own package manager. Raised only for deployments using that harness, satisfied by the harness's package list rather than by PATH, and installed only with explicit consent. The harness is named by `harness` (0.27.0) or by `runtime`, its pre-0.27 name that released manifests use: exactly one of the two.",
            "type": "object",
            "required": [
              "package",
              "why"
            ],
            "oneOf": [
              { "required": ["harness"], "not": { "required": ["runtime"] } },
              { "required": ["runtime"], "not": { "required": ["harness"] } }
            ],
            "properties": {
              "harness": {
                "type": "string",
                "enum": [
                  "pi",
                  "claude"
                ]
              },
              "runtime": {
                "type": "string",
                "description": "The pre-0.27 name of `harness`, accepted for released manifests.",
                "enum": [
                  "pi",
                  "claude"
                ]
              },
              "package": {
                "type": "string",
                "description": "Source spec in that harness's own naming: \"npm:@scope/name\" for pi, \"plugin@marketplace\" for Claude."
              },
              "why": {
                "type": "string"
              },
              "install": {
                "type": "string",
                "description": "Documentation URL shown alongside the consent prompt."
              },
              "marketplace": {
                "type": "string",
                "description": "Optional source to register before installing (Claude marketplaces). Shown at the consent prompt, since registering a third-party source is part of what is being agreed to."
              },
              "when": {
                "type": "object",
                "description": "Applies only when every named capability setting has the given effective value (a requirement conditional on configuration, e.g. delivery: channel).",
                "additionalProperties": {}
              },
              "minVersion": {
                "type": "string",
                "description": "Lowest acceptable installed version of the package, read from the package.json under the install directory the harness's listing names; an older or absent manifest fails the requirement with the install remedy.",
                "pattern": "^[0-9]+\\.[0-9]+\\.[0-9]+"
              },
              "ifInstalled": {
                "type": "boolean",
                "description": "When true, an absent package satisfies the row; the row's minVersion and loadability checks apply only to a package that is installed (an ambient extension that must honour a contract if present)."
              }
            },
            "additionalProperties": false
          }
        ]
      }
    },
    "commands": {
      "type": "object",
      "propertyNames": {
        "pattern": "^[a-z0-9][a-z0-9-]*$"
      },
      "additionalProperties": {
        "type": "string",
        "minLength": 1
      }
    },
    "binding": {
      "description": "Versioned provider-owned normalize/bind/check phases, each naming an existing command in this manifest. Runtime validation enforces that the phases belong to a core capability (a manifest with `layer`) and command references; presence is not approval or provider readiness.",
      "type": "object",
      "required": ["version", "normalize", "bind", "check"],
      "additionalProperties": false,
      "properties": {
        "version": { "const": 1 },
        "normalize": { "type": "string", "pattern": "^[a-z0-9][a-z0-9-]*$" },
        "bind": { "type": "string", "pattern": "^[a-z0-9][a-z0-9-]*$" },
        "check": { "type": "string", "pattern": "^[a-z0-9][a-z0-9-]*$" },
        "reasons": {
          "description": "Fixed nonsecret diagnostic strings allowed across the binding wire by exact match only. 1-64 unique printable ASCII strings of 1-200 characters, no braces/interpolation, operator values or paths. Omission uses the kernel's per-capability compatibility list when available; an invalid declaration never falls back.",
          "type": "array",
          "minItems": 1,
          "maxItems": 64,
          "uniqueItems": true,
          "items": { "type": "string", "minLength": 1, "maxLength": 200, "not": { "pattern": "[{}]|[^\\x20-\\x7e]" } }
        },
        "keys": {
          "description": "Owned operator-key declarations: exact names or trailing-dot namespaces, no other pattern syntax. Kernel 0.24.4 validates shape only; filtering, overlap checks and ownership attribution are deferred to 0.25. Providers must ignore foreign keys themselves.",
          "type": "array",
          "uniqueItems": true,
          "items": { "type": "string", "pattern": "^[A-Za-z][A-Za-z0-9_-]*\\.?$(?![\\s\\S])" }
        }
      }
    },
    "operations": {
      "description": "Named operations a GUI or scheduler may invoke through `oats operation run`, each delegating to one of this manifest's commands. kind \"view\" answers { documents: [{label, kind, path, text}] }; \"action\" (default) runs something. context \"home\" (default) runs in an instance home, \"scope\" in the config scope.",
      "type": "object",
      "propertyNames": {
        "pattern": "^[a-z][a-z0-9-]*$"
      },
      "additionalProperties": {
        "type": "object",
        "required": ["command"],
        "additionalProperties": false,
        "properties": {
          "command": { "type": "string", "minLength": 1 },
          "kind": { "enum": ["action", "view"] },
          "context": { "enum": ["home", "scope"] },
          "description": { "type": "string" },
          "args": {
            "type": "array",
            "items": {
              "type": "object",
              "required": ["name"],
              "additionalProperties": false,
              "properties": {
                "name": { "type": "string", "pattern": "^[a-z][a-z0-9-]*$" },
                "flag": { "type": "string", "pattern": "^--[a-z][a-z0-9-]*$" },
                "required": { "type": "boolean" },
                "description": { "type": "string" }
              }
            }
          }
        }
      }
    },
    "hooks": {
      "type": "object",
      "properties": {
        "soul-scaffold": {"$ref":"#/$defs/OptionalHook"},
        "spawn": {
          "oneOf":[
            {"type":"string"},
            {"type":"object","required":["command"],"additionalProperties":false,"properties":{"command":{"type":"string"},"required":{"type":"boolean","description":"When true, a failure fails the spawn."},"inputs":{"$ref":"#/$defs/HookInputs"}}}
          ]
        },
        "retire": {"$ref":"#/$defs/OptionalHook"},
        "launch": {"$ref":"#/$defs/OptionalHook"},
        "upgrade": {
          "$ref":"#/$defs/OptionalHook",
          "description":"Runs from the staged destination module for a stopped home's package upgrade or undo. OATS_UPGRADE_PHASE=plan is read-only and prints {adopt:true} or {adopt:false,reason,remedy}; apply prints {meta,warning?} on success. A non-zero apply must leave no provider effects through atomicity or compensation: kernel rollback covers composed home bytes only. Receives OATS_META (recorded state), OATS_UPGRADE_FROM (recorded from/commit/digest) and OATS_UPGRADE_TO (locked destination entry) as JSON. Never required."
        }
      },
      "additionalProperties": false
    },
    "agents": {
      "type": "array",
      "items": {
        "type": "string"
      },
      "description": "Package-relative soul directories (soul.yaml + AGENTS.md) \u2014 capability-defined agents; they resolve where the capability is active, souls stay read-only in the package, instances home under <deployment>/agents/<agent>/instances/."
    },
    "settings": {
      "type": "object",
      "description": "Declared capability settings: name to { default, values?, description }. Documentation for the values a soul, oats-local.yaml or `oats spawn --provider` supplies; undeclared settings are still accepted.",
      "additionalProperties": {
        "type": "object",
        "properties": {
          "default": {},
          "values": {
            "type": "array",
            "description": "Accepted scalar values; an effective value outside the list is refused at resolution.",
            "items": {}
          },
          "description": {
            "type": "string"
          },
          "hostOnly": {
            "type": "boolean",
            "description": "When true, this key is a host fact (a custody path, a state directory): the resolver accepts it only from the deployment's oats-local.yaml settings.<capability> and refuses it in the workspace file, byTeam payloads, a soul's slot payload and --provider flags (E_WORKSPACE_SCHEMA reason host-only-key). Decision 27."
          }
        },
        "additionalProperties": false
      }
    },
    "environmentNamespaces": {
      "type": "array",
      "description": "Additional environment-name prefixes this capability may declare besides its vendor's own (e.g. AWEB_ for the official oats.aweb messaging capability). Each is an uppercase prefix ending in an underscore; the reserved core (OATS_, PI_AGENT_) and process bootstrap namespaces cannot be claimed. Disclosed at trust time with the environment list.",
      "items": {
        "type": "string",
        "pattern": "^[A-Z][A-Z0-9]*_$"
      }
    }
  },
  "additionalProperties": false
}
