{
  "capability": "oats.okf",
  "command": "okf",
  "version": "5.5.0",
  "compatibility": {
    "oats": ">=0.69.2"
  },
  "layer": "knowledge",
  "description": "The OKF knowledge slot for working souls: consult the soul's accepted OKF bases remotely (no per-instance copy), keep instance knowledge with judgment, and at important checkpoints propose durable knowledge by spawning the oats.okf/knowledge-harvester package soul with a short, self-contained proposal.",
  "requires": [],
  "settings": {
    "bindings-file": {
      "description": "Absolute host-owned path identifying the version:1 bindings document. Portable binding preparation captures the selected document payload and never rereads this path."
    },
    "state-dir": {
      "description": "Absolute host-owned durable state directory for portable bindings. It is never derived from an instance home."
    },
    "git-timeout": {
      "description": "Seconds allowed for each Git operation that talks to a remote (clone, fetch, push, ls-remote); default 600. Local object reads keep a short fixed limit. Raise it for large repositories behind slow links."
    },
    "consult-max-age": {
      "description": "Seconds a Git base's host-cached accepted commit may age before an `oats okf` consult read refetches the accepted branch; default 300, 0 fetches on every read. `--fresh` always refetches."
    }
  },
  "skills": [
    "skills"
  ],
  "commands": {
    "harvest": "bin/oats-okf.mjs harvest",
    "status": "bin/oats-okf.mjs status",
    "inspect": "bin/oats-okf.mjs inspect",
    "setup": "bin/oats-okf.mjs setup",
    "run-source": "bin/oats-okf.mjs run-source",
    "complete": "bin/oats-okf.mjs complete",
    "retry": "bin/oats-okf.mjs retry",
    "bases": "bin/oats-okf.mjs bases",
    "index": "bin/oats-okf.mjs index",
    "cat": "bin/oats-okf.mjs cat",
    "ls": "bin/oats-okf.mjs ls",
    "links": "bin/oats-okf.mjs links",
    "search": "bin/oats-okf.mjs search",
    "read": "bin/oats-okf.mjs read",
    "refresh": "bin/oats-okf.mjs refresh",
    "init": "bin/oats-okf.mjs init",
    "migrate": "bin/oats-okf.mjs migrate",
    "unlock": "bin/oats-okf.mjs unlock",
    "binding-normalize": "bin/oats-okf-binding.mjs normalize",
    "binding-bind": "bin/oats-okf-binding.mjs bind",
    "binding-check": "bin/oats-okf-binding.mjs check",
    "harvest-status": "bin/oats-okf.mjs harvest-status"
  },
  "binding": {
    "version": 1,
    "normalize": "binding-normalize",
    "bind": "binding-bind",
    "check": "binding-check",
    "reasons": [
      "setting bindings-file is required (absolute host path)",
      "setting bindings-file must be a normalized absolute host path",
      "setting state-dir is required (absolute host path)",
      "setting state-dir must be a normalized absolute host path",
      "check action is not an admitted knowledge operation",
      "OKF settings missing bindings-file: set settings.oats.okf bindings-file, or deactivate oats.okf",
      "OKF soul declaration missing: create okf.json for this soul, or deactivate oats.okf",
      "E_REMOVED: OKF binding payloadVersion 1 (harvest runtime/model) was removed in oats.okf 5.0; respawn to bind with oats.okf 5 (the harvester uses the kernel's own harness and model)",
      "OKF binding missing or invalid: provision soul OKF declaration and bindings file, or deactivate oats.okf",
      "OKF bindings file missing or invalid: repair configured bindings file, or deactivate oats.okf",
      "more than 64 git knowledge bases declared",
      "declared knowledge base could not be staged from its git source",
      "declared knowledge base is not a validated knowledge tree",
      "knowledge base owner or remote custody requirement not met",
      "staged git source does not match the declared knowledge base",
      "declared knowledge nodes do not resolve in the accepted bases",
      "okf base <alias>: cached <cached>, accepted is now <accepted>; the next okf read refreshes it (or run `oats okf bases --fresh`)",
      "okf base <alias>: <repository> unreachable; readers serve the cached <cached> fetched <fetchedAt>",
      "okf base <alias> is not cached on this host yet: run `oats okf bases` (a spawn primes it)",
      "okf base <alias>: cached <cached> not yet validated on this host: run `oats okf bases`",
      "okf base <alias>: <repository> <acceptedBranch> unreachable (<reason>)",
      "okf base <alias>: declared node check skipped because the base is not cached",
      "E_REMOVED: <setting> <origin> was removed in oats.okf 5.0; <remedy>",
      "okf base <alias> not primed: <reason>; run `oats okf bases`"
    ]
  },
  "inject": "injects/okf.md",
  "helperInjection": {
    "version": 1,
    "mode": "omit"
  },
  "hooks": {
    "soul-scaffold": "bin/oats-okf.mjs soul-scaffold",
    "spawn": {
      "command": "bin/oats-okf.mjs spawn",
      "required": true
    },
    "upgrade": "bin/oats-okf.mjs upgrade"
  },
  "operations": {
    "inspect": {
      "kind": "view",
      "command": "inspect",
      "context": "home",
      "description": "Inspect the instance's working-memory documents, its declaration, the bases it reads, and any legacy local view."
    },
    "harvest": {
      "kind": "action",
      "command": "harvest",
      "context": "home",
      "description": "Removed in oats.okf 5.0: refuses with E_REMOVED and the new way (a proposal and a direct oats.okf/knowledge-harvester spawn). Kept declared so an old caller gets that answer, not an unknown operation."
    }
  }
}
